{
 "schema": "aihw/trace@0.1",
 "solution": "01-ipc.bailian",
 "variant": "default",
 "mode": "mock",
 "kit": "0.3",
 "args": [
  "--mock"
 ],
 "title": "01 IPC / AI 视觉 · 百炼事件理解参考 demo",
 "region": "cn-beijing",
 "models": [
  "qwen3.7-flash"
 ],
 "timing": "none",
 "events": [
  {
   "i": 0,
   "t_ms": null,
   "tag": "设备",
   "kind": "device",
   "text": "连接本地 mock 云端（按官方流式响应结构回放，不联网）",
   "lines": [],
   "assets": []
  },
  {
   "i": 1,
   "t_ms": null,
   "tag": "设备",
   "kind": "device",
   "text": "门口 · 移动侦测 → 抓拍 1 帧 01_door_package.jpg（15 KB）· 上传云端",
   "lines": [],
   "assets": [
    "samples/events/01_door_package.jpg"
   ]
  },
  {
   "i": 2,
   "t_ms": null,
   "tag": "云端",
   "kind": "cloud",
   "text": "事件理解 qwen3.7-flash（看图 · JSON）……",
   "lines": [],
   "assets": []
  },
  {
   "i": 3,
   "t_ms": null,
   "tag": "App",
   "kind": "result",
   "text": "事件卡 #1 · 09-30 18:20 · 门口 · 风险：低",
   "lines": [
    "门口有快递包裹 ｜ 快递包裹",
    "对象：快递纸箱、门垫、入户门 · 动作：包裹放在门口",
    "入户门前的门垫上放着一个贴有面单的纸箱，门关着，画面里没有人。"
   ],
   "assets": []
  },
  {
   "i": 4,
   "t_ms": null,
   "tag": "统计",
   "kind": "stats",
   "text": "抓拍完成 → 事件卡首字 —（mock 不计时） · ¥0.00026（输入 635 / 输出 165 Token）",
   "lines": [],
   "assets": []
  },
  {
   "i": 5,
   "t_ms": null,
   "tag": "设备",
   "kind": "device",
   "text": "客厅 · 移动侦测 → 抓拍 1 帧 02_cat_sofa_night.jpg（16 KB）· 上传云端",
   "lines": [],
   "assets": [
    "samples/events/02_cat_sofa_night.jpg"
   ]
  },
  {
   "i": 6,
   "t_ms": null,
   "tag": "云端",
   "kind": "cloud",
   "text": "事件理解 qwen3.7-flash（看图 · JSON）……",
   "lines": [],
   "assets": []
  },
  {
   "i": 7,
   "t_ms": null,
   "tag": "App",
   "kind": "result",
   "text": "事件卡 #2 · 09-30 21:47 · 客厅 · 风险：低",
   "lines": [
    "猫跳上客厅沙发 ｜ 宠物活动",
    "对象：橘猫、布艺沙发、茶几、落地灯 · 动作：跳跃、跳上沙发",
    "夜间客厅只开着落地灯，一只橘猫正从地面跃上灰色布艺沙发，周围没有人。"
   ],
   "assets": []
  },
  {
   "i": 8,
   "t_ms": null,
   "tag": "统计",
   "kind": "stats",
   "text": "抓拍完成 → 事件卡首字 —（mock 不计时） · ¥0.00027（输入 635 / 输出 178 Token）",
   "lines": [],
   "assets": []
  },
  {
   "i": 9,
   "t_ms": null,
   "tag": "设备",
   "kind": "device",
   "text": "厨房 · 画面变化 → 抓拍 1 帧 03_kitchen_kettle.jpg（29 KB）· 上传云端",
   "lines": [],
   "assets": [
    "samples/events/03_kitchen_kettle.jpg"
   ]
  },
  {
   "i": 10,
   "t_ms": null,
   "tag": "云端",
   "kind": "cloud",
   "text": "事件理解 qwen3.7-flash（看图 · JSON）……",
   "lines": [],
   "assets": []
  },
  {
   "i": 11,
   "t_ms": null,
   "tag": "App",
   "kind": "result",
   "text": "事件卡 #3 · 10-01 07:05 · 厨房 · 风险：中",
   "lines": [
    "燃气灶开着火，厨房无人 ｜ 用火用电",
    "对象：燃气灶、水壶、蓝色火焰、蒸汽 · 动作：烧水冒蒸汽",
    "燃气灶开着火在烧水，壶嘴冒出蒸汽，厨房里没有人，建议确认有人照看。"
   ],
   "assets": []
  },
  {
   "i": 12,
   "t_ms": null,
   "tag": "设备",
   "kind": "device",
   "text": "中风险 → 录制 30 秒云存片段 · App 强提醒",
   "lines": [],
   "assets": []
  },
  {
   "i": 13,
   "t_ms": null,
   "tag": "统计",
   "kind": "stats",
   "text": "抓拍完成 → 事件卡首字 —（mock 不计时） · ¥0.00027（输入 635 / 输出 179 Token）",
   "lines": [],
   "assets": []
  },
  {
   "i": 14,
   "t_ms": null,
   "tag": "设备",
   "kind": "device",
   "text": "客厅 · 移动侦测 → 抓拍 1 帧 04_vacuum_dog_morning.jpg（31 KB）· 上传云端",
   "lines": [],
   "assets": [
    "samples/events/04_vacuum_dog_morning.jpg"
   ]
  },
  {
   "i": 15,
   "t_ms": null,
   "tag": "云端",
   "kind": "cloud",
   "text": "事件理解 qwen3.7-flash（看图 · JSON）……",
   "lines": [],
   "assets": []
  },
  {
   "i": 16,
   "t_ms": null,
   "tag": "App",
   "kind": "result",
   "text": "事件卡 #4 · 10-01 07:40 · 客厅 · 风险：低",
   "lines": [
    "扫地机器人清扫，柯基趴着 ｜ 宠物活动",
    "对象：扫地机器人、柯基犬、地毯 · 动作：扫地机器人清扫、狗趴在地毯上",
    "白天客厅光线充足，扫地机器人在木地板上清扫，一只柯基趴在地毯上看着它，画面无异常。"
   ],
   "assets": []
  },
  {
   "i": 17,
   "t_ms": null,
   "tag": "统计",
   "kind": "stats",
   "text": "抓拍完成 → 事件卡首字 —（mock 不计时） · ¥0.00028（输入 635 / 输出 192 Token）",
   "lines": [],
   "assets": []
  },
  {
   "i": 18,
   "t_ms": null,
   "tag": "App",
   "kind": "result",
   "text": "事件列表 → out/events.json（4 条）",
   "lines": [],
   "assets": [
    "out/events.json"
   ]
  },
  {
   "i": 19,
   "t_ms": null,
   "tag": "App",
   "kind": "result",
   "text": "检索「找昨晚宠物跳沙发那段」",
   "lines": [],
   "assets": []
  },
  {
   "i": 20,
   "t_ms": null,
   "tag": "云端",
   "kind": "cloud",
   "text": "检索 qwen3.7-flash（4 个事件 · JSON）……",
   "lines": [],
   "assets": []
  },
  {
   "i": 21,
   "t_ms": null,
   "tag": "App",
   "kind": "result",
   "text": "找到 1 段，最相关的是 09-30 21:47 客厅：猫跳上客厅沙发。",
   "lines": [
    "#2 09-30 21:47 · 客厅 · 猫跳上客厅沙发 → samples/events/02_cat_sofa_night.jpg",
    "    理由：（mock 关键词匹配）时间在昨晚，命中「宠物、沙发」"
   ],
   "assets": [
    "samples/events/02_cat_sofa_night.jpg"
   ]
  },
  {
   "i": 22,
   "t_ms": null,
   "tag": "统计",
   "kind": "stats",
   "text": "检索首字 —（mock 不计时） · ¥0.00037",
   "lines": [],
   "assets": []
  },
  {
   "i": 23,
   "t_ms": null,
   "tag": "云端",
   "kind": "cloud",
   "text": "日报 qwen3.7-flash（流式 Markdown）……",
   "lines": [
    "# 家庭看护日报 · 2026-10-01",
    "",
    "最近一天记录 4 个事件，1 个需要留意。",
    "",
    "## 需要留意",
    "- 07:05 厨房 · 燃气灶开着火，厨房无人：请确认现场情况",
    "",
    "## 时间线",
    "- 18:20 门口 · 门口有快递包裹",
    "- 21:47 客厅 · 猫跳上客厅沙发",
    "- 07:05 厨房 · 燃气灶开着火，厨房无人",
    "- 07:40 客厅 · 扫地机器人清扫，柯基趴着",
    "",
    "## 小结",
    "（mock 示意）离线模式按事件列表拼出日报；填 Key 后由模型撰写。"
   ],
   "assets": []
  },
  {
   "i": 24,
   "t_ms": null,
   "tag": "App",
   "kind": "result",
   "text": "推送看护日报 → out/daily.md",
   "lines": [],
   "assets": [
    "out/daily.md"
   ]
  },
  {
   "i": 25,
   "t_ms": null,
   "tag": "统计",
   "kind": "stats",
   "text": "日报首字 —（mock 不计时） · ¥0.00045",
   "lines": [],
   "assets": []
  },
  {
   "i": 26,
   "t_ms": null,
   "tag": "统计",
   "kind": "stats",
   "text": "4 个事件合计 ¥0.0011 · 检索 ¥0.00037 · 日报 ¥0.00045",
   "lines": [],
   "assets": []
  }
 ],
 "result": {
  "models": [
   "qwen3.7-flash"
  ],
  "first_token_ms": null,
  "cost": {
   "low": 0.00027,
   "high": 0.00027
  },
  "sample": "4 帧事件（samples/events）",
  "note": "mock 用量为示意值；首字=抓拍完成→事件卡首字，4 帧均值；单次成本=每个事件；检索 ¥0.00037；日报 ¥0.00045"
 },
 "inputs": [
  {
   "path": "samples/events/01_door_package.jpg",
   "media_type": "image/jpeg",
   "bytes": 16213,
   "asset": "assets/01-ipc.bailian/samples/events/01_door_package.jpg"
  },
  {
   "path": "samples/events/02_cat_sofa_night.jpg",
   "media_type": "image/jpeg",
   "bytes": 17057,
   "asset": "assets/01-ipc.bailian/samples/events/02_cat_sofa_night.jpg"
  },
  {
   "path": "samples/events/03_kitchen_kettle.jpg",
   "media_type": "image/jpeg",
   "bytes": 30217,
   "asset": "assets/01-ipc.bailian/samples/events/03_kitchen_kettle.jpg"
  },
  {
   "path": "samples/events/04_vacuum_dog_morning.jpg",
   "media_type": "image/jpeg",
   "bytes": 32459,
   "asset": "assets/01-ipc.bailian/samples/events/04_vacuum_dog_morning.jpg"
  }
 ],
 "outputs": [
  {
   "path": "out/daily.md",
   "media_type": "text/markdown",
   "bytes": 484,
   "text": "# 家庭看护日报 · 2026-10-01\n\n最近一天记录 4 个事件，1 个需要留意。\n\n## 需要留意\n- 07:05 厨房 · 燃气灶开着火，厨房无人：请确认现场情况\n\n## 时间线\n- 18:20 门口 · 门口有快递包裹\n- 21:47 客厅 · 猫跳上客厅沙发\n- 07:05 厨房 · 燃气灶开着火，厨房无人\n- 07:40 客厅 · 扫地机器人清扫，柯基趴着\n\n## 小结\n（mock 示意）离线模式按事件列表拼出日报；填 Key 后由模型撰写。\n",
   "asset": null
  },
  {
   "path": "out/events.json",
   "media_type": "application/json",
   "bytes": 2372,
   "text": "{\n  \"now\": \"2026-10-01 08:30\",\n  \"events\": [\n    {\n      \"id\": 1,\n      \"time\": \"2026-09-30 18:20:05\",\n      \"camera\": \"门口\",\n      \"trigger\": \"移动侦测\",\n      \"image\": \"samples/events/01_door_package.jpg\",\n      \"title\": \"门口有快递包裹\",\n      \"objects\": [\n        \"快递纸箱\",\n        \"门垫\",\n        \"入户门\"\n      ],\n      \"actions\": [\n        \"包裹放在门口\"\n      ],\n      \"event\": \"快递包裹\",\n      \"risk_level\": \"low\",\n      \"description\": \"入户门前的门垫上放着一个贴有面单的纸箱，门关着，画面里没有人。\"\n    },\n    {\n      \"id\": 2,\n      \"time\": \"2026-09-30 21:47:10\",\n      \"camera\": \"客厅\",\n      \"trigger\": \"移动侦测\",\n      \"image\": \"samples/events/02_cat_sofa_night.jpg\",\n      \"title\": \"猫跳上客厅沙发\",\n      \"objects\": [\n        \"橘猫\",\n        \"布艺沙发\",\n        \"茶几\",\n        \"落地灯\"\n      ],\n      \"actions\": [\n        \"跳跃\",\n        \"跳上沙发\"\n      ],\n      \"event\": \"宠物活动\",\n      \"risk_level\": \"low\",\n      \"description\": \"夜间客厅只开着落地灯，一只橘猫正从地面跃上灰色布艺沙发，周围没有人。\"\n    },\n    {\n      \"id\": 3,\n      \"time\": \"2026-10-01 07:05:32\",\n      \"camera\": \"厨房\",\n      \"trigger\": \"画面变化\",\n      \"image\": \"samples/events/03_kitchen_kettle.jpg\",\n      \"title\": \"燃气灶开着火，厨房无人\",\n      \"objects\": [\n        \"燃气灶\",\n        \"水壶\",\n        \"蓝色火焰\",\n        \"蒸汽\"\n      ],\n      \"actions\": [\n        \"烧水冒蒸汽\"\n      ],\n      \"event\": \"用火用电\",\n      \"risk_level\": \"medium\",\n      \"description\": \"燃气灶开着火在烧水，壶嘴冒出蒸汽，厨房里没有人，建议确认有人照看。\"\n    },\n    {\n      \"id\": 4,\n      \"time\": \"2026-10-01 07:40:18\",\n      \"camera\": \"客厅\",\n      \"trigger\": \"移动侦测\",\n      \"image\": \"samples/events/04_vacuum_dog_morning.jpg\",\n      \"title\": \"扫地机器人清扫，柯基趴着\",\n      \"objects\": [\n        \"扫地机器人\",\n        \"柯基犬\",\n        \"地毯\"\n      ],\n      \"actions\": [\n        \"扫地机器人清扫\",\n        \"狗趴在地毯上\"\n      ],\n      \"event\": \"宠物活动\",\n      \"risk_level\": \"low\",\n      \"description\": \"白天客厅光线充足，扫地机器人在木地板上清扫，一只柯基趴在地毯上看着它，画面无异常。\"\n    }\n  ]\n}\n",
   "asset": null
  }
 ],
 "error": null
}
