{
 "schema": "aihw/trace@0.1",
 "solution": "05-desktop-pet.bailian",
 "variant": "default",
 "mode": "mock",
 "kit": "0.3",
 "args": [
  "--mock"
 ],
 "title": "05 桌宠 · 百炼实时语音陪伴参考 demo",
 "region": "cn-beijing",
 "models": [
  "qwen3.8-omni-flash-realtime",
  "qwen3.7-flash"
 ],
 "timing": "none",
 "events": [
  {
   "i": 0,
   "t_ms": null,
   "tag": "设备",
   "kind": "device",
   "text": "开机，连接本地 mock 云端（按官方事件顺序回放，不联网）",
   "lines": [],
   "assets": []
  },
  {
   "i": 1,
   "t_ms": null,
   "tag": "设备",
   "kind": "device",
   "text": "屏幕：我是 AI 桌宠「豆豆」，对话内容由 AI 生成",
   "lines": [
    ".-----------.",
    "|  o     o  |",
    "|    \\_/    |",
    "'-----------'"
   ],
   "assets": []
  },
  {
   "i": 2,
   "t_ms": null,
   "tag": "云端",
   "kind": "cloud",
   "text": "会话就绪：音色 longanlingxin · 按键说话（Manual） · 已注册 pet_expression",
   "lines": [],
   "assets": []
  },
  {
   "i": 3,
   "t_ms": null,
   "tag": "设备",
   "kind": "device",
   "text": "头顶按键按下 · 灯光：蓝光（聆听中）",
   "lines": [],
   "assets": []
  },
  {
   "i": 4,
   "t_ms": null,
   "tag": "设备",
   "kind": "device",
   "text": "麦克风 ← owner_1.wav（3.6 s）",
   "lines": [],
   "assets": [
    "samples/owner_1.wav"
   ]
  },
  {
   "i": 5,
   "t_ms": null,
   "tag": "设备",
   "kind": "device",
   "text": "按键松开 → 提交本轮",
   "lines": [],
   "assets": []
  },
  {
   "i": 6,
   "t_ms": null,
   "tag": "云端",
   "kind": "cloud",
   "text": "听到：豆豆，方案终于交上去啦！",
   "lines": [],
   "assets": []
  },
  {
   "i": 7,
   "t_ms": null,
   "tag": "设备",
   "kind": "device",
   "text": "屏幕：大笑 · 动作：跳一下 · 灯光：暖黄呼吸（pet_expression）",
   "lines": [
    ".-----------.",
    "|  ^     ^  |",
    "|   \\___/   |",
    "'-----------'"
   ],
   "assets": []
  },
  {
   "i": 8,
   "t_ms": null,
   "tag": "豆豆",
   "kind": "result",
   "text": "哇，交上去啦！这几天熬夜辛苦了，必须跳一下庆祝！今晚早点休息吧。",
   "lines": [],
   "assets": []
  },
  {
   "i": 9,
   "t_ms": null,
   "tag": "设备",
   "kind": "device",
   "text": "扬声器 → out/reply_1.wav（0.9 s）",
   "lines": [],
   "assets": [
    "out/reply_1.wav"
   ]
  },
  {
   "i": 10,
   "t_ms": null,
   "tag": "统计",
   "kind": "stats",
   "text": "第 1 轮 · 首包音频 —（mock 不计时） · ¥0.0037（输入 1492 / 输出 132 Token）",
   "lines": [],
   "assets": []
  },
  {
   "i": 11,
   "t_ms": null,
   "tag": "设备",
   "kind": "device",
   "text": "头顶按键按下 · 灯光：蓝光（聆听中）",
   "lines": [],
   "assets": []
  },
  {
   "i": 12,
   "t_ms": null,
   "tag": "设备",
   "kind": "device",
   "text": "麦克风 ← owner_2.wav（4.2 s）",
   "lines": [],
   "assets": [
    "samples/owner_2.wav"
   ]
  },
  {
   "i": 13,
   "t_ms": null,
   "tag": "设备",
   "kind": "device",
   "text": "按键松开 → 提交本轮",
   "lines": [],
   "assets": []
  },
  {
   "i": 14,
   "t_ms": null,
   "tag": "云端",
   "kind": "cloud",
   "text": "听到：不过老板说下周还要大改，有点累。",
   "lines": [],
   "assets": []
  },
  {
   "i": 15,
   "t_ms": null,
   "tag": "设备",
   "kind": "device",
   "text": "屏幕：难过 · 动作：伸爪抱抱 · 灯光：蓝色低亮（pet_expression）",
   "lines": [
    ".-----------.",
    "|  T     T  |",
    "|    .-.    |",
    "'-----------'"
   ],
   "assets": []
  },
  {
   "i": 16,
   "t_ms": null,
   "tag": "豆豆",
   "kind": "result",
   "text": "先抱抱主人。改稿确实磨人，不过底子已经打好了。明天先列个修改清单，一条条来会轻松很多。",
   "lines": [],
   "assets": []
  },
  {
   "i": 17,
   "t_ms": null,
   "tag": "设备",
   "kind": "device",
   "text": "扬声器 → out/reply_2.wav（0.9 s）",
   "lines": [],
   "assets": [
    "out/reply_2.wav"
   ]
  },
  {
   "i": 18,
   "t_ms": null,
   "tag": "统计",
   "kind": "stats",
   "text": "第 2 轮 · 首包音频 —（mock 不计时） · ¥0.0046（输入 1616 / 输出 171 Token）",
   "lines": [],
   "assets": []
  },
  {
   "i": 19,
   "t_ms": null,
   "tag": "设备",
   "kind": "device",
   "text": "头顶按键按下 · 灯光：蓝光（聆听中）",
   "lines": [],
   "assets": []
  },
  {
   "i": 20,
   "t_ms": null,
   "tag": "设备",
   "kind": "device",
   "text": "麦克风 ← owner_3.wav（3.5 s）",
   "lines": [],
   "assets": [
    "samples/owner_3.wav"
   ]
  },
  {
   "i": 21,
   "t_ms": null,
   "tag": "设备",
   "kind": "device",
   "text": "按键松开 → 提交本轮",
   "lines": [],
   "assets": []
  },
  {
   "i": 22,
   "t_ms": null,
   "tag": "云端",
   "kind": "cloud",
   "text": "听到：好啦，先下班了，明天见。",
   "lines": [],
   "assets": []
  },
  {
   "i": 23,
   "t_ms": null,
   "tag": "设备",
   "kind": "device",
   "text": "屏幕：微笑 · 动作：点点头 · 灯光：暖白常亮（pet_expression）",
   "lines": [
    ".-----------.",
    "|  o     o  |",
    "|    \\_/    |",
    "'-----------'"
   ],
   "assets": []
  },
  {
   "i": 24,
   "t_ms": null,
   "tag": "豆豆",
   "kind": "result",
   "text": "好呀，路上注意安全，明天见！",
   "lines": [],
   "assets": []
  },
  {
   "i": 25,
   "t_ms": null,
   "tag": "设备",
   "kind": "device",
   "text": "扬声器 → out/reply_3.wav（0.6 s）",
   "lines": [],
   "assets": [
    "out/reply_3.wav"
   ]
  },
  {
   "i": 26,
   "t_ms": null,
   "tag": "统计",
   "kind": "stats",
   "text": "第 3 轮 · 首包音频 —（mock 不计时） · ¥0.004（输入 1752 / 输出 69 Token）",
   "lines": [],
   "assets": []
  },
  {
   "i": 27,
   "t_ms": null,
   "tag": "设备",
   "kind": "device",
   "text": "听到道别 → 结束陪伴，屏幕切换为待机表情",
   "lines": [
    ".-----------. zZ",
    "|  -     -  |",
    "|    ___    |",
    "'-----------'"
   ],
   "assets": []
  },
  {
   "i": 28,
   "t_ms": null,
   "tag": "云端",
   "kind": "cloud",
   "text": "陪伴日记 qwen3.7-flash（流式 JSON）……",
   "lines": [],
   "assets": []
  },
  {
   "i": 29,
   "t_ms": null,
   "tag": "App",
   "kind": "result",
   "text": "推送陪伴日记 → out/diary.md",
   "lines": [
    "# 2026-10-01 · 豆豆的日记：方案交上去的一天",
    "",
    "今天主人把熬了好几天的方案交上去了，我跳了一下帮主人庆祝！不过老板说下周还要大改，主人有点累，我抱了抱主人，建议先列个修改清单。傍晚主人下班了，说了明天见。希望主人今晚睡个好觉。",
    "",
    "今日心情：疲惫 ⭐⭐⭐ | 互动次数：3 次 | 最爱动作：跳一下",
    "",
    "明天想关心：问问修改清单列好了没有",
    "",
    "## 记住的事",
    "- [生活事件] 主人的方案已经提交，下周要按老板意见大改",
    "- [情绪事件] 连续熬夜改方案，主人有点累",
    "",
    "> 由 qwen3.8-omni-flash-realtime 对话 + qwen3.7-flash 整理（mock 示意内容）。记忆存放在 out/ 目录，删除即清空。"
   ],
   "assets": [
    "out/diary.md"
   ]
  },
  {
   "i": 30,
   "t_ms": null,
   "tag": "设备",
   "kind": "device",
   "text": "记忆写回 out/memory.mock.json：共 2 条（下次开机注入系统提示词）",
   "lines": [],
   "assets": [
    "out/memory.mock.json"
   ]
  },
  {
   "i": 31,
   "t_ms": null,
   "tag": "统计",
   "kind": "stats",
   "text": "陪伴 3 轮 · 每轮均值 ¥0.0041 · 日记 ¥0.00027（输入 511 / 输出 211 Token）",
   "lines": [],
   "assets": []
  }
 ],
 "result": {
  "models": [
   "qwen3.8-omni-flash-realtime",
   "qwen3.7-flash"
  ],
  "first_token_ms": null,
  "cost": {
   "low": 0.004097,
   "high": 0.004097
  },
  "sample": "owner_1.wav + owner_2.wav + owner_3.wav",
  "note": "mock 用量为示意值；3 轮均值；首字=松开按键→首包音频；含 pet_expression；日记 ¥0.00027 另计"
 },
 "inputs": [
  {
   "path": "samples/owner_1.wav",
   "media_type": "audio/wav",
   "bytes": 115278,
   "asset": "assets/05-desktop-pet.bailian/samples/owner_1.wav"
  },
  {
   "path": "samples/owner_2.wav",
   "media_type": "audio/wav",
   "bytes": 134478,
   "asset": "assets/05-desktop-pet.bailian/samples/owner_2.wav"
  },
  {
   "path": "samples/owner_3.wav",
   "media_type": "audio/wav",
   "bytes": 111278,
   "asset": "assets/05-desktop-pet.bailian/samples/owner_3.wav"
  }
 ],
 "outputs": [
  {
   "path": "out/diary.md",
   "media_type": "text/markdown",
   "bytes": 755,
   "text": "# 2026-10-01 · 豆豆的日记：方案交上去的一天\n\n今天主人把熬了好几天的方案交上去了，我跳了一下帮主人庆祝！不过老板说下周还要大改，主人有点累，我抱了抱主人，建议先列个修改清单。傍晚主人下班了，说了明天见。希望主人今晚睡个好觉。\n\n今日心情：疲惫 ⭐⭐⭐ | 互动次数：3 次 | 最爱动作：跳一下\n\n明天想关心：问问修改清单列好了没有\n\n## 记住的事\n- [生活事件] 主人的方案已经提交，下周要按老板意见大改\n- [情绪事件] 连续熬夜改方案，主人有点累\n\n> 由 qwen3.8-omni-flash-realtime 对话 + qwen3.7-flash 整理（mock 示意内容）。记忆存放在 out/ 目录，删除即清空。\n",
   "asset": null
  },
  {
   "path": "out/memory.mock.json",
   "media_type": "application/json",
   "bytes": 402,
   "text": "{\n  \"pet\": \"豆豆\",\n  \"updated\": \"2026-10-01\",\n  \"follow_up\": \"问问修改清单列好了没有\",\n  \"memories\": [\n    {\n      \"date\": \"2026-10-01\",\n      \"type\": \"生活事件\",\n      \"content\": \"主人的方案已经提交，下周要按老板意见大改\"\n    },\n    {\n      \"date\": \"2026-10-01\",\n      \"type\": \"情绪事件\",\n      \"content\": \"连续熬夜改方案，主人有点累\"\n    }\n  ]\n}\n",
   "asset": null
  },
  {
   "path": "out/reply_1.wav",
   "media_type": "audio/wav",
   "bytes": 43244,
   "text": null,
   "asset": "assets/05-desktop-pet.bailian/outputs/default/reply_1.wav"
  },
  {
   "path": "out/reply_2.wav",
   "media_type": "audio/wav",
   "bytes": 43244,
   "text": null,
   "asset": "assets/05-desktop-pet.bailian/outputs/default/reply_2.wav"
  },
  {
   "path": "out/reply_3.wav",
   "media_type": "audio/wav",
   "bytes": 28844,
   "text": null,
   "asset": "assets/05-desktop-pet.bailian/outputs/default/reply_3.wav"
  }
 ],
 "error": null
}
